{
  "contract_version": "implementation-record.v1",
  "record_id": "IR-20260713-PLATFORM-INTEGRATION-FRESHNESS-GATE-R3",
  "title": "平台集成分支新鲜度门禁最终治理刷新",
  "date": "2026-07-13",
  "status": "implemented",
  "objective": "在门禁实现冻结后重新读取最终治理输入，以不可变 R3 检查单和 100 分考试关闭 R2 SHA 漂移；独立复核前仍不调和真实分支。",
  "governance_checklist": "contracts/foundation/development-checklists/2026-07-13-platform-integration-freshness-gate-r3.json",
  "governance_exam": "contracts/foundation/governance-exams/2026-07-13-platform-integration-freshness-gate-r3-attempt-1.json",
  "governance_inputs": [
    "AGENTS.md",
    "README.md",
    "CONSTRAINTS.md",
    "contracts/foundation/recurring-issues.v1.json",
    "contracts/foundation/agent-collaboration.v1.json",
    "docs/decisions/0012-two-strike-root-cause-rule.md",
    "docs/decisions/0015-isolated-agent-work-and-controlled-integration.md"
  ],
  "requirement_sources": [
    "docs/project-management/notices/2026-07-13-platform-integration-freshness-gate-task-order.md"
  ],
  "capabilities": [
    "foundation.ai-collaboration-safety",
    "foundation.governance-certification",
    "foundation.contract-tooling"
  ],
  "contracts": [
    "contracts/foundation/integration-push-policy.v1.json",
    "contracts/foundation/integration-push-policy.v1.schema.json",
    "contracts/foundation/recurring-issues.v1.json"
  ],
  "decisions": [
    "docs/decisions/0010-ai-implementation-records-required.md",
    "docs/decisions/0012-two-strike-root-cause-rule.md",
    "docs/decisions/0015-isolated-agent-work-and-controlled-integration.md"
  ],
  "changed_areas": [
    "contracts/foundation/development-checklists/2026-07-13-platform-integration-freshness-gate-r3.json",
    "contracts/foundation/governance-exams/2026-07-13-platform-integration-freshness-gate-r3-attempt-1.json",
    "contracts/foundation/implementation-records/2026-07-13-platform-integration-freshness-gate-r3.json",
    "docs/project-management/service-plaza/platform-integration-freshness-gate-2026-07-13.md"
  ],
  "verification": [
    "R2 checklist and exam preserved byte-for-byte as historical evidence",
    "R3 final governance inputs reread with 26/26 current SHA matches",
    "R3 governance exam attempt 1 passed with score 100",
    "policy and recurring issue validators pass",
    "freshness gate temporary Git regression 8/8 pass",
    "real bb9e717 reconciliation not executed before independent review"
  ],
  "evidence": [
    "docs/project-management/service-plaza/platform-integration-freshness-gate-2026-07-13.md",
    "contracts/foundation/development-checklists/2026-07-13-platform-integration-freshness-gate-r3.json",
    "contracts/foundation/governance-exams/2026-07-13-platform-integration-freshness-gate-r3-attempt-1.json"
  ],
  "premises": [
    "final governance input hashes must be frozen before current certification",
    "historical snapshots remain immutable when superseded",
    "third recurrence requires ADR, CONSTRAINTS and full dependent audit"
  ],
  "implementation_mode": "ai-assisted"
}
