{
  "contract_version": "implementation-record.v1",
  "record_id": "IR-20260711-CLUB-CAPACITY-DECOUPLING",
  "title": "标准俱乐部与家庭容量配置依赖解耦",
  "date": "2026-07-11",
  "status": "implemented",
  "objective": "消除 standard 自建俱乐部申请和批准对 family 容量业务变量的错误依赖，同时保持 family 配置缺失时失败关闭。",
  "governance_checklist": "contracts/foundation/development-checklists/2026-07-11-club-capacity-decoupling.json",
  "governance_exam": "contracts/foundation/governance-exams/2026-07-11-club-capacity-decoupling-attempt-1.json",
  "governance_inputs": ["AGENTS.md", "README.md", "CONSTRAINTS.md", "contracts/foundation/governance-reading-list.v1.json", "contracts/foundation/agent-collaboration.v1.json", "contracts/foundation/module-dependencies/club-alliance.v1.json", "contracts/modules/club-alliance/internal-dependencies.v1.json", "docs/project-management/module-internal-dependency-standard-v1.md"],
  "requirement_sources": ["docs/project-management/notices/2026-07-11-club-alliance-first-phase-task-order.md", "docs/project-management/modules/club-alliance-first-slice-contract-v1.md", "docs/project-management/service-plaza/parallel-module-notice-audit-2026-07-11.md"],
  "capabilities": ["foundation.authorization-idempotency", "foundation.business-variables", "foundation.ai-collaboration-safety"],
  "contracts": ["contracts/foundation/module-dependencies/club-alliance.v1.json", "contracts/modules/club-alliance/internal-dependencies.v1.json", "docs/project-management/modules/club-alliance-first-slice-contract-v1.md"],
  "decisions": ["docs/decisions/0007-stable-foundation-variable-business.md", "docs/decisions/0008-versioned-business-variables.md", "docs/decisions/0010-ai-implementation-records-required.md", "docs/decisions/0015-isolated-agent-work-and-controlled-integration.md"],
  "changed_areas": ["backend-go/plugins/club-plugin/service.go", "backend-go/plugins/club-plugin/service_test.go", "contracts/foundation/agent-collaboration.v1.json", "contracts/modules/club-alliance/internal-dependencies.v1.json", "docs/project-management/modules/club-alliance-first-slice-contract-v1.md", "docs/project-management/service-plaza/club-capacity-decoupling-2026-07-11.md", "docs/project-management/service-plaza/handoff-log.md"],
  "verification": ["go test -count=1 ./plugins/club-plugin", "go test -count=1 ./...", "go vet ./...", "scripts/Test-ServicePlazaContracts.ps1", "scripts/Test-TextEncoding.ps1", "git diff --check"],
  "evidence": ["docs/project-management/service-plaza/club-capacity-decoupling-2026-07-11.md", "contracts/foundation/development-checklists/2026-07-11-club-capacity-decoupling.json", "contracts/foundation/governance-exams/2026-07-11-club-capacity-decoupling-attempt-1.json", "docs/project-management/service-plaza/handoff-log.md"],
  "premises": ["club type 在申请和审核期间不会由该接口改变", "家庭容量是 family 专属业务变量，standard/direct 不应读取它", "family 容量未配置或解析失败时必须失败关闭，不能提供代码默认值", "本地全量 Go 回归不等于测试环境已验证，因此依赖状态只能是 implemented", "本切片不改变本人状态、审核幂等、权限或资金接口"],
  "implementation_mode": "ai-assisted"
}
