{
  "contract_version": "implementation-record.v1",
  "record_id": "IR-20260713-LEARNING-PLAZA-M0-R4",
  "title": "学习广场M0-R4独立invariant分层纠偏",
  "date": "2026-07-13",
  "status": "implemented",
  "objective": "拆分Schema与独立invariant计数，并使五类关键架构变异分别被Schema、手写invariant和fixtures拒绝。",
  "governance_checklist": "contracts/modules/learning-plaza/development-checklists/2026-07-13-learning-plaza-m0-r4.json",
  "governance_exam": "contracts/modules/learning-plaza/governance-exams/2026-07-13-learning-plaza-m0-r4-attempt-1.json",
  "governance_inputs": ["AGENTS.md", "README.md", "CONSTRAINTS.md", "contracts/foundation/governance-reading-list.v1.json", "contracts/foundation/agent-collaboration.v1.json", "contracts/foundation/foundation-capabilities.v1.json", "contracts/foundation/engineering-standards.v1.json", "contracts/foundation/recurring-issues.v1.json", "docs/project-management/dependency-driven-master-plan-v1.md", "docs/project-management/recursive-project-governance-v1.md", "docs/project-management/notices/2026-07-13-learning-plaza-m0-task-order.md", "docs/decisions/0014-ai-development-flight-checklist.md", "docs/decisions/0015-isolated-agent-work-and-controlled-integration.md", "docs/decisions/0017-readme-course-and-random-governance-exam.md", "docs/decisions/0018-recursive-project-governance.md"],
  "requirement_sources": ["docs/project-management/modules/learning-plaza/requirements-v3.0.md", "docs/project-management/modules/learning-plaza/independent-acceptance-m0-r3-no-go.md"],
  "capabilities": ["foundation.ai-engineering-traceability", "foundation.governance-certification", "foundation.service-action-contracts", "foundation.identity-api", "foundation.authorization-idempotency", "foundation.contract-tooling", "foundation.observability-config", "foundation.delivery-recovery", "foundation.app-shell-adapter"],
  "contracts": ["contracts/modules/learning-plaza/platform-dependencies.v1.json", "contracts/modules/learning-plaza/internal-dependencies.v1.json", "contracts/modules/learning-plaza/m0-r2/learning-plaza-architecture.v3.json", "contracts/modules/learning-plaza/m0-r2/learning-plaza-architecture.v3.schema.json", "contracts/modules/learning-plaza/m0-r2/fixtures/cases.v3.json"],
  "decisions": ["docs/project-management/modules/learning-plaza/decisions/0001-independent-learning-platform.md", "docs/decisions/0007-stable-foundation-variable-business.md", "docs/decisions/0010-ai-implementation-records-required.md", "docs/decisions/0015-isolated-agent-work-and-controlled-integration.md", "docs/decisions/0017-readme-course-and-random-governance-exam.md", "docs/decisions/0018-recursive-project-governance.md"],
  "changed_areas": ["contracts/modules/learning-plaza", "docs/project-management/modules/learning-plaza"],
  "verification": ["R4 checklist 28/28 with current hashes", "R4 exam generated after checklist completion and scored 100", "platform dependencies 9/9", "Draft 2020-12 valid schema errors 0", "M0-R4 deterministic fixtures 34/34", "five critical mutations each have separate schema invariant fixture rejection", "old M0 fixtures 16/16", "module internal dependency gate", "implementation record gate", "UTF-8 gate", "git diff check"],
  "evidence": ["docs/project-management/modules/learning-plaza/independent-acceptance-m0-r3-no-go.md", "docs/project-management/modules/learning-plaza/root-causes/LP-RC-ARCH-CONTRACT-FALSE-GREEN-R3.md", "docs/project-management/modules/learning-plaza/m0-r2-conformance-report.md", "docs/project-management/modules/learning-plaza/handoff-m0.md", "contracts/modules/learning-plaza/invalidated-snapshots/m0-pre-r4/README.md"],
  "premises": ["R4 remains mock-only and non-production", "all runtime ports remain provisional and fail closed", "R4 requires a new independent acceptance verdict", "M1 and runtime paths remain separately authorized", "latest integration freshness must be rechecked immediately before controlled integration"],
  "implementation_mode": "ai-assisted"
}
