{
  "contract_version": "implementation-record.v1",
  "record_id": "IR-20260714-PLATFORM-REGISTRY-DISPATCH-R1-R11-R2",
  "title": "Platform lifecycle freshness repair and planned legacy state migration R11-R2",
  "date": "2026-07-14",
  "status": "verified",
  "objective": "在不改变immutable legacy status的前提下刷新Activity、Mall、NOVA Runtime生命周期，转交NOVA API独立验收，真实取消已被主工作项吸收的cross-record reviewer supporting checkpoint，并只规划显式legacy state migration治理项。",
  "governance_checklist": "contracts/foundation/development-checklists/2026-07-14-platform-registry-dispatch-r1-r11-r2.json",
  "governance_exam": "contracts/foundation/governance-exams/2026-07-14-platform-registry-dispatch-r1-r11-r2-attempt-1.json",
  "governance_inputs": ["AGENTS.md", "README.md", "CONSTRAINTS.md", "contracts/foundation/agent-collaboration.v1.json", "contracts/foundation/delivery-flow-policy.v1.json", "docs/decisions/0014-ai-development-flight-checklist.md", "docs/decisions/0015-isolated-agent-work-and-controlled-integration.md", "docs/decisions/0016-ai-agent-authority-and-untrusted-context.md", "docs/decisions/0017-readme-course-and-random-governance-exam.md", "docs/decisions/0018-recursive-project-governance.md"],
  "requirement_sources": ["docs/project-management/notices/2026-07-14-platform-registry-dispatch-r1-task-order.md"],
  "capabilities": ["foundation.ai-collaboration-safety", "foundation.governance-certification", "foundation.recurrence-prevention"],
  "contracts": ["contracts/foundation/agent-collaboration.v1.json", "contracts/foundation/delivery-flow-policy.v1.json", "contracts/foundation/development-checklist.v1.schema.json", "contracts/foundation/governance-exam.v1.schema.json"],
  "decisions": ["docs/decisions/0014-ai-development-flight-checklist.md", "docs/decisions/0015-isolated-agent-work-and-controlled-integration.md", "docs/decisions/0016-ai-agent-authority-and-untrusted-context.md", "docs/decisions/0017-readme-course-and-random-governance-exam.md", "docs/decisions/0018-recursive-project-governance.md"],
  "changed_areas": ["Activity V3 M0 active freshness and legacy migration blocker", "Protection Mall M2 Catalog active freshness and legacy migration blocker", "NOVA Phase5 Runtime active freshness and ToolRuntime E2E checkpoint", "NOVA API Signoff handoff-ready lifecycle", "cross-record reviewer supporting checkpoint cancelled/superseded lifecycle", "dispatch R11-R2 freshness", "one planned platform legacy state migration work item", "R11-R2 task order, checklist, exam, implementation record and Handoff"],
  "verification": ["authority dc8a52a current-clock total originally failed with four status expiries and one reviewer response SLA breach", "R11 initial Activity and Mall status transitions were rejected by immutable legacy snapshot/state-hash gates and were fully removed before R11-R2", "Activity exact 9d474ee7 and Mall exact 22073cd8 are remote-exact clean candidates while their registry statuses remain active", "NOVA Runtime remains active and is gated on fresh formal Overlay evidence before TaskRuntime to ToolRuntime synthetic E2E", "NOVA API artifact f5546f25 is an authority ancestor and five contract/Handoff blobs are byte-identical at dc8a52a", "cross-record reviewer source efad99b is an ancestor of artifact dafdd09f and evidence SHA-256 equals f8a247a68532f2d198ffea4a8acc0724849099a1832a36282537b01e798c38e9", "registry 126 to 127 rows changes only six existing target rows plus one planned legacy migration item; other 120 rows are field-identical", "R11-R2 current checklist 26/26, SHA-256 45e52008ff12c3dcb3466edead3ae5332ee967408263586cf5fa7764d5cd63ad, current mismatch 0", "R11-R2 governance exam attempt-1 score 100", "five validators, delivery-flow regression tests, aggregate Service Plaza contract, UTF-8, diff, scope, secret and remote checks"],
  "evidence": ["docs/project-management/notices/2026-07-14-platform-registry-dispatch-r1-task-order.md", "docs/project-management/service-plaza/platform-registry-dispatch-r1-handoff.md", "docs/project-management/independent-acceptance/platform-exam-ir-cross-record-gate/evidence.md"],
  "premises": ["legacy external snapshot 33f5e454 and its first 115 work-id/status pairs remain immutable in R11-R2", "the planned migration item is not active authority to edit policy or validator", "supporting evidence is a checkpoint and cannot create a second integrated business outcome", "dispatch does not independently accept or integrate Activity, Mall, NOVA API, NOVA Overlay or cross-record evidence", "production, deployment, real data, real funds and irreversible operations remain No-Go"],
  "implementation_mode": "ai-assisted"
}
