{
  "contract_version": "implementation-record.v1",
  "record_id": "IR-20260718-SINGLE-MAINLINE-S4-UAT-PRODUCT-REPAIR-R1-G2",
  "title": "S4 UAT 六路由产品修复 R1 G2 实施与 R2 失败关闭修复",
  "date": "2026-07-18",
  "status": "implemented",
  "objective": "修复 R5 UAT 六路由缺陷并补齐 Project Brain full-shape fail-closed，完成一次性测试与构建证据，形成待独立提交验收的候选。",
  "governance_checklist": "contracts/foundation/development-checklists/2026-07-18-single-mainline-s4-uat-repair-r1-g2.json",
  "governance_exam": "contracts/foundation/governance-exams/2026-07-18-single-mainline-s4-uat-repair-r1-g2-attempt-1.json",
  "governance_inputs": [
    "contracts/foundation/governance-reading-list.v1.json", "AGENTS.md", "README.md", "CONSTRAINTS.md",
    "docs/project-management/service-plaza/project-status-one-page.md", "docs/project-management/dependency-driven-master-plan-v1.md",
    "contracts/foundation/foundation-capabilities.v1.json", "contracts/foundation/engineering-standards.v1.json",
    "contracts/foundation/recurring-issues.v1.json", "contracts/foundation/agent-collaboration.v1.json",
    "docs/project-management/ai-coding-incident-lessons-2026-07-10.md", "docs/project-management/recursive-project-governance-v1.md",
    "docs/project-management/foundation-dependency-standard-v1.md", "docs/project-management/module-internal-dependency-standard-v1.md",
    "docs/decisions/0007-stable-foundation-variable-business.md", "docs/decisions/0008-versioned-business-variables.md",
    "docs/decisions/0009-approved-toolchain-per-layer.md", "docs/decisions/0010-ai-implementation-records-required.md",
    "docs/decisions/0011-two-person-config-approval.md", "docs/decisions/0012-two-strike-root-cause-rule.md",
    "docs/decisions/0013-mandatory-ai-development-entrypoint.md", "docs/decisions/0014-ai-development-flight-checklist.md",
    "docs/decisions/0015-isolated-agent-work-and-controlled-integration.md", "docs/decisions/0016-ai-agent-authority-and-untrusted-context.md",
    "docs/decisions/0017-readme-course-and-random-governance-exam.md", "docs/decisions/0018-recursive-project-governance.md"
  ],
  "requirement_sources": [
    "docs/project-management/notices/2026-07-18-single-mainline-s4-uat-repair-r1-task-order.md",
    "docs/project-management/pdcar/task-comprehension-single-mainline-s4-uat-repair-r1.md",
    "docs/project-management/pdcar/root-cause-single-mainline-s4-uat-repair-r1.md"
  ],
  "capabilities": ["foundation.ai-engineering-traceability", "foundation.ai-collaboration-safety", "foundation.governance-certification", "foundation.recurrence-prevention"],
  "contracts": ["contracts/foundation/agent-collaboration.v1.json", "contracts/foundation/development-checklist.v1.schema.json", "contracts/foundation/governance-exam.v1.schema.json", "contracts/foundation/implementation-record.v1.schema.json"],
  "decisions": ["docs/decisions/0010-ai-implementation-records-required.md", "docs/decisions/0012-two-strike-root-cause-rule.md", "docs/decisions/0014-ai-development-flight-checklist.md", "docs/decisions/0015-isolated-agent-work-and-controlled-integration.md", "docs/decisions/0016-ai-agent-authority-and-untrusted-context.md", "docs/decisions/0017-readme-course-and-random-governance-exam.md", "docs/decisions/0018-recursive-project-governance.md"],
  "changed_areas": [
    "contracts/foundation/development-checklists/2026-07-18-single-mainline-s4-uat-repair-r1-g2.json",
    "contracts/foundation/governance-exams/2026-07-18-single-mainline-s4-uat-repair-r1-g2-attempt-1.json",
    "contracts/foundation/implementation-records/2026-07-18-single-mainline-s4-uat-repair-r1-g2.json",
    "docs/project-management/pdcar/handoff-single-mainline-s4-uat-repair-r1.md",
    "app/src/App.tsx",
    "app/src/App.test.tsx",
    "app/src/pages/PlannedServicePage.tsx",
    "app/src/modules/club-alliance/ClubAllianceRoute.tsx",
    "app/src/modules/club-alliance/index.ts",
    "app/src/modules/club-alliance/self-created/SelfCreatedClubPage.tsx",
    "app/src/modules/club-alliance/self-created/SelfCreatedClubPage.test.tsx",
    "app/src/modules/project-brain/projectBrainApi.ts",
    "app/src/modules/project-brain/ProjectBrainPage.test.tsx",
    "app/vite.config.ts"
  ],
  "verification": [
    "R3 activation SHA-256 DEAA23E2B2817629C986B40C94AA93E4FAB5DE5C8CD3D68F136DA6F8906949A6 was consumed once and failed closed with P0/P1/P2 0/2/0 because a global historical checklist gate was added and native nonzero propagation was unreliable",
    "R4 activation SHA-256 E0B0CBEAD4525EB2F55FB14DC2FDFEE2284C9B91A7C47B5543E248DE80EED07F was consumed once; target checklist, existing Exam100, IR and registry validators each passed as standalone commands",
    "evidence checklist copy was repaired by deleting its only extra terminal LF and is byte-identical to source SHA-256 6CC05FF24F835CE0AEFE504EA90D2279E00072A27D42C34A31C92F4A6A967C77",
    "target-specific current checklist validator passed for all 26 governance inputs",
    "random governance exam attempt 1 passed 8 of 8 with score 100",
    "registry remains 158 rows at SHA-256 BC408AB6BB92D9059128A4225DEAD41BA1866BBC66607824FEE138C008A3D8B7",
    "governance preparation closed with product diff zero before the separate product G2 activation",
    "product G2 activation SHA-256 F042D2874E492E112207C72E0E155C6959ED4097688A8887645D6ACBC77C63BF was consumed once with all ten exact product baselines current",
    "explicit activity-plaza, Nova AI and club member-home routes were added; self-created guest DOM has one authentication state marker and route-specific titles",
    "Project Brain rejects HTML/parser leakage and the build emits a strict UTF-8 snapshot with source_freshness unknown and overall_verdict no-go instead of copying the stale current-labelled snapshot",
    "focused tests passed 35/35, full tests passed 254/254, and the single test-server build succeeded",
    "generated snapshot SHA-256 B6FF78A47742904563213ABD0D23839C2D800BFD78F84367836DDDE359177034; no dependency, registry, commit, push, integration or deployment action occurred",
    "independent Product G2 R1 Execution Acceptance was No-Go with P0/P1/P2 0/1/1 because top-level collection checks did not validate member shapes or summary numeric values; acceptance MD SHA-256 26A875DC18673A7D5687C1BE2A2D2066C5C12BF9F9150F9E035D31052FA8E1AA and JSON SHA-256 4B1EC2B0BCED8639C5767CFFDD6434C4CA8A2590D7F45371D0C6FAFF5122981E",
    "Product G2 R2 remediation activation SHA-256 AB37B4FFB87845E9547108AD25CF0501403D68F0F786C2D5C2AD988B5BBBE13B was consumed once after exact fresh precheck",
    "Project Brain now validates every work item, module, decision and risk member shape and accepts only finite non-negative integer work_summary and audit_summary values",
    "R2 focused Project Brain tests passed 13/13, full tests passed 261/261, and the single test-server build succeeded; all commands ran exactly once",
    "R2 generated snapshot SHA-256 1398C19895CE6600048C240C0C7ECEB14904ED6A2A17F4F1A5348A99D14A605B remains truthful with source_freshness unknown and overall_verdict no-go; all eight frozen product paths, registry, package-lock and node_modules Junction remained exact"
  ],
  "evidence": [
    "contracts/foundation/development-checklists/2026-07-18-single-mainline-s4-uat-repair-r1-g2.json",
    "contracts/foundation/governance-exams/2026-07-18-single-mainline-s4-uat-repair-r1-g2-attempt-1.json",
    "docs/project-management/pdcar/handoff-single-mainline-s4-uat-repair-r1.md",
    "C:/Users/shugo/Documents/项目最高负责人/2026-07-18-全局暂停与单主线重排/s4-product-repair-r1/g15-registry-deps-r1/review-g15-execution-r1/g2-governance-prep-r3-activation.json",
    "C:/Users/shugo/Documents/项目最高负责人/2026-07-18-全局暂停与单主线重排/s4-product-repair-r1/g15-registry-deps-r1/review-g15-execution-r1/product-g2-r2-remediation-activation.json",
    "C:/Users/shugo/Documents/项目最高负责人/2026-07-18-全局暂停与单主线重排/s4-product-repair-r1/g15-registry-deps-r1/review-g15-execution-r1/product-g2-r2-remediation-evidence"
  ],
  "premises": [
    "2df75badec2ae5f8c7b04c4c3ae2602b8d4f2ef9 remains the accepted and deployed frontend candidate",
    "R5 immutable browser evidence remains the sole current UAT fact source and is not modified or reused",
    "G1 and G1.5 are independently accepted and provide no residual product write authority",
    "R3 is consumed and No-Go; R4 authorizes validation and evidence freeze only and does not authorize product changes, tests, build, commit, push, integration or deployment",
    "product G2 R1 and R2 activations are consumed and cannot be reused; the remediated uncommitted candidate requires fresh independent R2 execution acceptance before any commit, push, integration or deployment authority"
  ],
  "implementation_mode": "ai-assisted"
}
