{
  "contract_version":"implementation-record.v1",
  "record_id":"IR-20260712-HEALTH-MVP90-M1-P1-R3",
  "title":"健康大管家 MVP-90 M1 P1 签署语义忠实性与 fixture exact-set 修订",
  "date":"2026-07-12",
  "status":"verified",
  "objective":"关闭P1-XR-01至03：消除专业边界和场景安全语义的第二真相源，解析源指针并逐字段锁定签署原文，为15个fixture增加Schema、exact set、唯一性和负向变异。",
  "governance_checklist":"contracts/modules/health-manager/development-checklists/2026-07-12-health-mvp90-m1-p1-r3.json",
  "governance_exam":"contracts/modules/health-manager/governance-exams/2026-07-12-health-mvp90-m1-p1-r3-attempt-1.json",
  "governance_inputs":["contracts/foundation/governance-reading-list.v1.json","AGENTS.md","README.md","CONSTRAINTS.md","docs/project-management/service-plaza/project-status-one-page.md","docs/project-management/dependency-driven-master-plan-v1.md","contracts/foundation/foundation-capabilities.v1.json","contracts/foundation/engineering-standards.v1.json","contracts/foundation/recurring-issues.v1.json","contracts/foundation/agent-collaboration.v1.json","docs/project-management/ai-coding-incident-lessons-2026-07-10.md","docs/project-management/recursive-project-governance-v1.md","docs/project-management/foundation-dependency-standard-v1.md","docs/project-management/module-internal-dependency-standard-v1.md","docs/decisions/0007-stable-foundation-variable-business.md","docs/decisions/0008-versioned-business-variables.md","docs/decisions/0009-approved-toolchain-per-layer.md","docs/decisions/0010-ai-implementation-records-required.md","docs/decisions/0011-two-person-config-approval.md","docs/decisions/0012-two-strike-root-cause-rule.md","docs/decisions/0013-mandatory-ai-development-entrypoint.md","docs/decisions/0014-ai-development-flight-checklist.md","docs/decisions/0015-isolated-agent-work-and-controlled-integration.md","docs/decisions/0016-ai-agent-authority-and-untrusted-context.md","docs/decisions/0017-readme-course-and-random-governance-exam.md","docs/decisions/0018-recursive-project-governance.md","contracts/foundation/module-dependencies/health-manager.v1.json","contracts/modules/health-manager/internal-dependencies.v1.json"],
  "requirement_sources":["docs/project-management/notices/2026-07-12-health-manager-mvp90-m1-task-order.md","docs/project-management/modules/health-manager/health-manager-mvp90-m1-requirements.md","docs/project-management/modules/health-manager/health-manager-mvp90-m1-professional-decision-packet.md","docs/project-management/modules/health-manager/health-manager-mvp90-m1-conformance-report.md"],
  "capabilities":["foundation.ai-engineering-traceability","foundation.governance-certification","foundation.authorization-idempotency","foundation.contract-tooling"],
  "contracts":["contracts/modules/health-manager/mvp90-m1/professional-boundaries.v1.json","contracts/modules/health-manager/mvp90-m1/professional-boundaries.v1.schema.json","contracts/modules/health-manager/mvp90-m1/synthetic-pdcar-scenarios.v1.json","contracts/modules/health-manager/mvp90-m1/synthetic-pdcar-scenarios.v1.schema.json","contracts/modules/health-manager/mvp90-m1/conformance/fixtures/synthetic-pdcar-fixtures.v1.json","contracts/modules/health-manager/mvp90-m1/conformance/fixtures/synthetic-pdcar-fixtures.v1.schema.json"],
  "decisions":["docs/decisions/0010-ai-implementation-records-required.md","docs/decisions/0012-two-strike-root-cause-rule.md","docs/decisions/0016-ai-agent-authority-and-untrusted-context.md"],
  "changed_areas":["contracts/modules/health-manager/mvp90-m1","contracts/modules/health-manager/internal-dependencies.v1.json","contracts/modules/health-manager/development-checklists","contracts/modules/health-manager/governance-exams","contracts/modules/health-manager/implementation-records","docs/project-management/modules/health-manager"],
  "verification":["python -X utf8 contracts/modules/health-manager/mvp90-m1/conformance/test_health_mvp90_m1_contracts.py","17/17 fail_closed exact match","17/17 transfer_owner exact match","15/15 scenario safety fields exact match","source pointer negative mutations","fixture Draft 2020-12 Schema and exact/unique mutations","validate_module_internal_dependencies.py","validate_development_checklists.py","validate_governance_exams.py","validate_implementation_records.py","validate_agent_collaboration.py","Test-ServicePlazaContracts.ps1","Test-TextEncoding.ps1","git diff --check","allowed-path and sensitive-pattern scans"],
  "evidence":["contracts/modules/health-manager/development-checklists/2026-07-12-health-mvp90-m1-p1-r3.json","contracts/modules/health-manager/governance-exams/2026-07-12-health-mvp90-m1-p1-r3-attempt-1.json","contracts/modules/health-manager/mvp90-m1/conformance/test_health_mvp90_m1_contracts.py","contracts/modules/health-manager/mvp90-m1/conformance/fixtures/synthetic-pdcar-fixtures.v1.schema.json","docs/project-management/modules/health-manager/health-manager-mvp90-m1-conformance-report.md","docs/project-management/modules/health-manager/health-manager-mvp90-m1-handoff.md"],
  "premises":["signed C4-H01 and professional scenario review remain unchanged","derived contracts must use signed Chinese semantics as the only authoritative values","all M1 contracts remain executable=false","C4-L02-L04, global C4-H06 and production identity remain Pending","no shared code, environment, real data or production is authorized","platform independent re-review is required"],
  "implementation_mode":"ai-assisted"
}
