{
  "contract_version": "implementation-record.v1",
  "record_id": "IR-20260713-DELIVERY-FLOW-OPTIMIZATION-R4",
  "title": "平台交付流与商业价值门禁最终当前认证",
  "date": "2026-07-13",
  "status": "implemented",
  "objective": "用当前权威基线证明交付流加速和商业价值门禁可执行，并形成独立验收包。",
  "governance_checklist": "contracts/foundation/development-checklists/2026-07-13-delivery-flow-optimization-r4.json",
  "governance_exam": "contracts/foundation/governance-exams/2026-07-13-delivery-flow-optimization-r4-attempt-1.json",
  "governance_inputs": [
    "AGENTS.md",
    "README.md",
    "CONSTRAINTS.md",
    "contracts/foundation/agent-collaboration.v1.json",
    "docs/project-management/dependency-driven-master-plan-v1.md",
    "docs/project-management/recursive-project-governance-v1.md",
    "docs/decisions/0015-isolated-agent-work-and-controlled-integration.md",
    "docs/decisions/0018-recursive-project-governance.md"
  ],
  "requirement_sources": ["docs/project-management/notices/2026-07-13-delivery-flow-optimization-task-order.md"],
  "capabilities": ["foundation.ai-collaboration-safety", "foundation.governance-certification", "foundation.contract-tooling"],
  "contracts": [
    "contracts/foundation/delivery-flow-policy.v1.json",
    "contracts/foundation/delivery-flow-policy.v1.schema.json",
    "contracts/foundation/agent-collaboration.v1.json",
    "contracts/foundation/agent-collaboration.v1.schema.json"
  ],
  "decisions": [
    "docs/decisions/0010-ai-implementation-records-required.md",
    "docs/decisions/0015-isolated-agent-work-and-controlled-integration.md",
    "docs/decisions/0018-recursive-project-governance.md"
  ],
  "changed_areas": [
    "contracts/foundation/delivery-flow-policy.v1.json",
    "contracts/foundation/delivery-flow-policy.v1.schema.json",
    "contracts/foundation/agent-collaboration.v1.json",
    "contracts/foundation/agent-collaboration.v1.schema.json",
    "scripts/validate_delivery_flow_policy.py",
    "scripts/tests/test_validate_delivery_flow_policy.py",
    "docs/project-management/notices/2026-07-13-delivery-flow-optimization-task-order.md",
    "docs/project-management/service-plaza/delivery-flow-optimization-2026-07-13.md",
    "docs/project-management/service-plaza/project-status-one-page.md"
  ],
  "verification": [
    "R4 current governance checklist completed 26 of 26",
    "R4 governance exam attempt 1 passed with score 100",
    "candidate contains authoritative integration HEAD 094bafdbba48c84f41611ca541c8225e4de4a8dd",
    "delivery flow policy, collaboration registry and five regression tests pass",
    "activity and protection-mall value contracts are machine validated",
    "real payment, real data, production and authority expansion remain fail-closed"
  ],
  "evidence": [
    "docs/project-management/service-plaza/delivery-flow-optimization-2026-07-13.md",
    "contracts/foundation/development-checklists/2026-07-13-delivery-flow-optimization-r4.json",
    "contracts/foundation/governance-exams/2026-07-13-delivery-flow-optimization-r4-attempt-1.json"
  ],
  "premises": [
    "commercial value can be tested first with deterministic synthetic journeys",
    "legacy work migrates at its next checkpoint without inventing historical fields",
    "independent acceptance remains required before controlled integration"
  ],
  "implementation_mode": "ai-assisted"
}
