{
  "contract_version": "implementation-record.v1",
  "record_id": "IR-20260711-CLUB-ALLIANCE-H1-M2",
  "title": "俱乐部联盟 CA-H1 M2 精确路由与八态标准首页壳",
  "date": "2026-07-11",
  "status": "verified",
  "objective": "将俱乐部联盟从通用业务承接页切换到独立精确路由和零业务 API 首页壳，使服务广场与首页共用 M1 adapter，并以真实目录、query、权限和生命周期驱动八态、响应式、可访问性及网络边界。",
  "governance_checklist": "contracts/modules/club-alliance/development-checklists/2026-07-11-club-alliance-h1-m2.json",
  "governance_exam": "contracts/modules/club-alliance/governance-exams/2026-07-11-club-alliance-h1-m2-attempt-1.json",
  "governance_inputs": [
    "contracts/foundation/governance-reading-list.v1.json",
    "AGENTS.md",
    "README.md",
    "CONSTRAINTS.md",
    "docs/project-management/service-plaza/project-status-one-page.md",
    "docs/project-management/dependency-driven-master-plan-v1.md",
    "contracts/foundation/foundation-capabilities.v1.json",
    "contracts/foundation/engineering-standards.v1.json",
    "contracts/foundation/recurring-issues.v1.json",
    "contracts/foundation/agent-collaboration.v1.json",
    "docs/project-management/ai-coding-incident-lessons-2026-07-10.md",
    "docs/project-management/recursive-project-governance-v1.md",
    "docs/project-management/foundation-dependency-standard-v1.md",
    "docs/project-management/module-internal-dependency-standard-v1.md",
    "docs/decisions/0007-stable-foundation-variable-business.md",
    "docs/decisions/0008-versioned-business-variables.md",
    "docs/decisions/0009-approved-toolchain-per-layer.md",
    "docs/decisions/0010-ai-implementation-records-required.md",
    "docs/decisions/0011-two-person-config-approval.md",
    "docs/decisions/0012-two-strike-root-cause-rule.md",
    "docs/decisions/0013-mandatory-ai-development-entrypoint.md",
    "docs/decisions/0014-ai-development-flight-checklist.md",
    "docs/decisions/0015-isolated-agent-work-and-controlled-integration.md",
    "docs/decisions/0016-ai-agent-authority-and-untrusted-context.md",
    "docs/decisions/0017-readme-course-and-random-governance-exam.md",
    "docs/decisions/0018-recursive-project-governance.md",
    "contracts/foundation/module-dependencies/club-alliance.v1.json",
    "contracts/modules/club-alliance/internal-dependencies.v1.json"
  ],
  "requirement_sources": [
    "docs/project-management/notices/2026-07-11-club-alliance-h1-task-order.md",
    "contracts/modules/club-alliance/homepage.v1.json",
    "docs/project-management/service-plaza/handoff-log.md"
  ],
  "capabilities": [
    "foundation.ai-engineering-traceability",
    "foundation.governance-certification",
    "foundation.service-action-contracts",
    "foundation.observability-config",
    "foundation.app-shell-adapter"
  ],
  "contracts": [
    "contracts/service-plaza/service-plaza-actions.v1.json",
    "contracts/modules/club-alliance/homepage.v1.json",
    "app/src/modules/club-alliance/clubAllianceHomepageContract.ts",
    "app/src/modules/club-alliance/clubAllianceActionAdapter.ts",
    "app/src/modules/club-alliance/ClubAllianceRoute.tsx",
    "app/src/modules/club-alliance/ClubAlliancePage.tsx"
  ],
  "decisions": [
    "docs/project-management/modules/club-alliance/CA-F0-H0-decisions.md",
    "docs/decisions/0007-stable-foundation-variable-business.md",
    "docs/decisions/0017-readme-course-and-random-governance-exam.md",
    "docs/decisions/0018-recursive-project-governance.md"
  ],
  "changed_areas": [
    "app/src/App.tsx",
    "app/src/App.test.tsx",
    "app/src/pages/ServicePlazaPage.tsx",
    "app/src/pages/ServicePlazaPage.action.test.tsx",
    "app/src/modules/club-alliance/index.ts",
    "app/src/modules/club-alliance/ClubAllianceRoute.tsx",
    "app/src/modules/club-alliance/ClubAlliancePage.tsx",
    "app/src/modules/club-alliance/ClubAlliancePage.css",
    "app/src/modules/club-alliance/ClubAlliancePage.test.tsx",
    "app/src/modules/club-alliance/clubAllianceActionAdapter.test.ts",
    "contracts/modules/club-alliance/development-checklists",
    "contracts/modules/club-alliance/governance-exams",
    "contracts/modules/club-alliance/implementation-records",
    "docs/project-management/modules/club-alliance/CA-H1-handoff.md"
  ],
  "verification": [
    "npm test",
    "npm run build",
    "npm run build:test-server",
    "powershell -NoProfile -ExecutionPolicy Bypass -File scripts/Test-ServicePlazaContracts.ps1",
    "python -X utf8 scripts/validate_development_checklists.py",
    "python -X utf8 scripts/validate_governance_exams.py",
    "python -X utf8 scripts/validate_implementation_records.py",
    "python -X utf8 scripts/validate_agent_collaboration.py",
    "powershell -NoProfile -ExecutionPolicy Bypass -File scripts/Test-TextEncoding.ps1",
    "git diff --check"
  ],
  "evidence": [
    "contracts/modules/club-alliance/development-checklists/2026-07-11-club-alliance-h1-m2.json",
    "contracts/modules/club-alliance/governance-exams/2026-07-11-club-alliance-h1-m2-attempt-1.json",
    "app/src/modules/club-alliance/ClubAlliancePage.test.tsx",
    "app/src/pages/ServicePlazaPage.action.test.tsx",
    "app/src/App.test.tsx",
    "docs/project-management/modules/club-alliance/CA-H1-handoff.md"
  ],
  "premises": [
    "SP-H029 M1 Go and integration HEAD 7c987ff remain the accepted M2 starting point",
    "catalog and actions are the only network reads initiated by the H1 route",
    "ActionControl, the shared evaluator and telemetry remain authoritative and are consumed without modification",
    "selectors remain non-executable and the page does not search, create, join, review, manage members, pay, qualify charity or create federation relationships",
    "deployment, production and four child-project business flows remain separately authorized downstream work"
  ],
  "implementation_mode": "ai-assisted"
}
